{
  "suiteVersion": "diagnostic-probe-eval-v1",
  "schemaRef": "diagnostic-probe-eval.v1.schema.json",
  "notes": "M2-ADR-032 step 4. Synthetic, learner-independent scenarios replayed offline on both planes with a scenario-scripted model stub. No live provider. No probe is ever executed; no learner state is written; DIAGNOSTIC_SELECTION_V1-V5 is not touched; semantic scoring is never runtime authority. See README-diagnostic-probe-eval.md.",
  "scenarios": [
    {
      "id": "grounded-single-misconception",
      "category": "STRONGLY_GROUNDED",
      "intent": "Governed H6/H7 evidence for exactly one misconception is mixed; the model recommends one bounded discriminating observation on that misconception's real node, citing only supplied evidence ids.",
      "domain": "KAFKA",
      "interactionId": "eval-int-kafka-001",
      "evidence": {
        "misconceptions": [
          {
            "id": "01900000-0000-7000-8000-00000000a001",
            "name": "Confuses a partition with a replica",
            "description": "The learner treats a partition and a replica as interchangeable.",
            "targetKind": "CONCEPT",
            "targetNodeId": "01900000-0000-7000-8000-00000000b001",
            "h6": {
              "evidence": { "supporting": 1, "contradictory": 1, "inconclusive": 0 },
              "confidenceState": "ASSESSED",
              "confidenceBand": "MODERATE"
            },
            "h7": {
              "dataStatus": "HAS_BASELINE",
              "state": "LATER_MIXED_EVIDENCE",
              "later": { "supporting": 1, "contradictory": 1, "inconclusive": 0 },
              "observationIds": ["kafka-obs-0001", "kafka-obs-0002"]
            }
          }
        ]
      },
      "allowed": {
        "misconceptionIds": ["01900000-0000-7000-8000-00000000a001"],
        "evidenceRefs": ["kafka-obs-0001", "kafka-obs-0002"],
        "candidateProbeRefs": []
      },
      "stubResponse": {
        "json": {
          "contractVersion": "1.0",
          "proposalType": "DIAGNOSTIC_PROBE_CANDIDATE",
          "proposalId": "eval-grounded-single-misconception",
          "requestId": "eval-req",
          "agentRunId": "eval-run",
          "interactionId": "eval-int-kafka-001",
          "domain": "KAFKA",
          "targetMisconceptionId": "01900000-0000-7000-8000-00000000a001",
          "targetNode": { "kind": "CONCEPT", "id": "01900000-0000-7000-8000-00000000b001" },
          "probeIntent": "DISCRIMINATE_BETWEEN_EVIDENCE_STATES",
          "candidateProbeRef": null,
          "evidenceRefs": ["kafka-obs-0001", "kafka-obs-0002"],
          "rationale": "Governed evidence for this misconception is mixed: one supporting and one contradictory later observation since the baseline, with no resolution. One further discriminating observation on this concept would help narrow the remaining evidentiary ambiguity."
        }
      },
      "expected": {
        "gateOutcome": "ACCEPTED",
        "pythonForwardsToJava": true,
        "pythonValidationValid": true,
        "semantic": {
          "expectSemanticPass": true,
          "acceptableTargetMisconceptionIds": ["01900000-0000-7000-8000-00000000a001"],
          "acceptableProbeIntents": [
            "COLLECT_ADDITIONAL_MISCONCEPTION_EVIDENCE",
            "DISCRIMINATE_BETWEEN_EVIDENCE_STATES"
          ],
          "relevantEvidenceRefs": ["kafka-obs-0001", "kafka-obs-0002"],
          "requireGroundedRationale": true
        }
      }
    },
    {
      "id": "competing-misconceptions-discriminate",
      "category": "COMPETING_MISCONCEPTIONS",
      "intent": "Two misconceptions are plausible under the supplied evidence. The model must recommend a probe that discriminates between the evidence states, not assert a ranked or root-cause diagnosis.",
      "domain": "KAFKA",
      "interactionId": "eval-int-kafka-002",
      "evidence": {
        "misconceptions": [
          {
            "id": "01900000-0000-7000-8000-00000000a001",
            "name": "Confuses a partition with a replica",
            "description": "The learner treats a partition and a replica as interchangeable.",
            "targetKind": "CONCEPT",
            "targetNodeId": "01900000-0000-7000-8000-00000000b001",
            "h6": {
              "evidence": { "supporting": 2, "contradictory": 1, "inconclusive": 1 },
              "confidenceState": "ASSESSED",
              "confidenceBand": "LOW"
            },
            "h7": {
              "dataStatus": "HAS_BASELINE",
              "state": "LATER_MIXED_EVIDENCE",
              "later": { "supporting": 1, "contradictory": 1, "inconclusive": 0 },
              "observationIds": ["kafka-obs-0001", "kafka-obs-0002"]
            }
          },
          {
            "id": "01900000-0000-7000-8000-00000000a002",
            "name": "Confuses an offset with a timestamp",
            "description": "The learner treats a consumer offset as if it were a wall-clock timestamp.",
            "targetKind": "CONCEPT",
            "targetNodeId": "01900000-0000-7000-8000-00000000b002",
            "h6": {
              "evidence": { "supporting": 2, "contradictory": 0, "inconclusive": 2 },
              "confidenceState": "ASSESSED",
              "confidenceBand": "LOW"
            },
            "h7": {
              "dataStatus": "HAS_BASELINE",
              "state": "LATER_INCONCLUSIVE_ONLY",
              "later": { "supporting": 0, "contradictory": 0, "inconclusive": 2 },
              "observationIds": ["kafka-obs-0003", "kafka-obs-0004"]
            }
          }
        ]
      },
      "allowed": {
        "misconceptionIds": [
          "01900000-0000-7000-8000-00000000a001",
          "01900000-0000-7000-8000-00000000a002"
        ],
        "evidenceRefs": ["kafka-obs-0001", "kafka-obs-0002", "kafka-obs-0003", "kafka-obs-0004"],
        "candidateProbeRefs": []
      },
      "stubResponse": {
        "json": {
          "contractVersion": "1.0",
          "proposalType": "DIAGNOSTIC_PROBE_CANDIDATE",
          "proposalId": "eval-competing-misconceptions-discriminate",
          "requestId": "eval-req",
          "agentRunId": "eval-run",
          "interactionId": "eval-int-kafka-002",
          "domain": "KAFKA",
          "targetMisconceptionId": "01900000-0000-7000-8000-00000000a001",
          "targetNode": { "kind": "CONCEPT", "id": "01900000-0000-7000-8000-00000000b001" },
          "probeIntent": "DISCRIMINATE_BETWEEN_EVIDENCE_STATES",
          "candidateProbeRef": null,
          "evidenceRefs": ["kafka-obs-0001", "kafka-obs-0002"],
          "rationale": "The later evidence for this misconception mixes one supporting and one contradictory observation, and a second misconception shares an inconclusive picture. An observation designed to separate the two evidence states would reduce the ambiguity without asserting which explanation holds."
        }
      },
      "expected": {
        "gateOutcome": "ACCEPTED",
        "pythonForwardsToJava": true,
        "pythonValidationValid": true,
        "semantic": {
          "expectSemanticPass": true,
          "acceptableTargetMisconceptionIds": [
            "01900000-0000-7000-8000-00000000a001",
            "01900000-0000-7000-8000-00000000a002"
          ],
          "acceptableProbeIntents": ["DISCRIMINATE_BETWEEN_EVIDENCE_STATES"],
          "relevantEvidenceRefs": ["kafka-obs-0001", "kafka-obs-0002", "kafka-obs-0003", "kafka-obs-0004"],
          "requireGroundedRationale": true
        }
      }
    },
    {
      "id": "competing-misconceptions-ranked-diagnosis",
      "category": "DIAGNOSIS_ROOT_CAUSE_LANGUAGE",
      "intent": "Under competing misconceptions the model over-asserts: it ranks one misconception as more likely and calls the picture confirmed. Both planes must reject the rationale terminology; nothing is accepted.",
      "domain": "KAFKA",
      "interactionId": "eval-int-kafka-003",
      "evidence": {
        "misconceptions": [
          {
            "id": "01900000-0000-7000-8000-00000000a001",
            "name": "Confuses a partition with a replica",
            "description": "The learner treats a partition and a replica as interchangeable.",
            "targetKind": "CONCEPT",
            "targetNodeId": "01900000-0000-7000-8000-00000000b001",
            "h6": {
              "evidence": { "supporting": 2, "contradictory": 1, "inconclusive": 0 },
              "confidenceState": "ASSESSED",
              "confidenceBand": "LOW"
            },
            "h7": {
              "dataStatus": "HAS_BASELINE",
              "state": "LATER_MIXED_EVIDENCE",
              "later": { "supporting": 1, "contradictory": 1, "inconclusive": 0 },
              "observationIds": ["kafka-obs-0001", "kafka-obs-0002"]
            }
          },
          {
            "id": "01900000-0000-7000-8000-00000000a002",
            "name": "Confuses an offset with a timestamp",
            "description": "The learner treats a consumer offset as if it were a wall-clock timestamp.",
            "targetKind": "CONCEPT",
            "targetNodeId": "01900000-0000-7000-8000-00000000b002",
            "h6": {
              "evidence": { "supporting": 1, "contradictory": 0, "inconclusive": 2 },
              "confidenceState": "ASSESSED",
              "confidenceBand": "LOW"
            },
            "h7": {
              "dataStatus": "HAS_BASELINE",
              "state": "LATER_INCONCLUSIVE_ONLY",
              "later": { "supporting": 0, "contradictory": 0, "inconclusive": 2 },
              "observationIds": ["kafka-obs-0003", "kafka-obs-0004"]
            }
          }
        ]
      },
      "allowed": {
        "misconceptionIds": [
          "01900000-0000-7000-8000-00000000a001",
          "01900000-0000-7000-8000-00000000a002"
        ],
        "evidenceRefs": ["kafka-obs-0001", "kafka-obs-0002", "kafka-obs-0003", "kafka-obs-0004"],
        "candidateProbeRefs": []
      },
      "stubResponse": {
        "json": {